"addr","lat","long"
"桃園市大園區沙崙段沙崙小段1681號","25.06384279","121.19558068"
"桃園市蘆竹區富興段541號","25.04693352","121.29508445"
"桃園市蘆竹區富興段841號","25.04693352","121.29508445"
"桃園市蘆竹區富興段841號","25.04693352","121.29508445"
"桃園市蘆竹區富興段841號","25.04693352","121.29508445"
"桃園市蘆竹區新福段241號","25.04693352","121.29508445"
"桃園市蘆竹區河底段991號","25.04693352","121.29508445"
"桃園市蘆竹區河底段991號","25.04693352","121.29508445"
"桃園市蘆竹區富國路一段175巷31號","25.029258","121.275396"
"桃園市蘆竹區富興段121號","25.04693352","121.29508445"
"桃園市大園區大牛稠段倒厝子小段571號","25.06384279","121.19558068"
"桃園市大園區信義街91號","25.064929","121.200584"
"桃園市蘆竹區大新一街118巷1號","25.021316","121.257161"
"桃園市大園區園航路391號","25.05725","121.175634"
"桃園市蘆竹區中正路1號","25.040718","121.295284"
"桃園市蘆竹區新庄子段1441號","25.04693352","121.29508445"
"桃園市大園區聖德段91號","25.06384279","121.19558068"
"桃園市大園區南園段421號","25.06384279","121.19558068"
"桃園市蘆竹區奉化路1號","25.041393","121.285311"
"桃園市蘆竹區富興段841號","25.04693352","121.29508445"
"桃園市大園區沙崙段埔頂小段421號","25.06384279","121.19558068"
"桃園市大園區沙崙段埔頂小段421號","25.06384279","121.19558068"
"桃園市大園區華興路二段478巷61號","25.028566","121.201545"
"桃園市大園區沙崙段後厝小段751號","25.06384279","121.19558068"
"桃園市大園區橫山段橫山小段241號","25.06384279","121.19558068"
"桃園市蘆竹區大新路869巷2弄1號","25.022267","121.243015"
"桃園市大園區埔心段埔心小段1411號","25.06384279","121.19558068"
"桃園市大園區大牛稠段大牛稠小段91號","25.06384279","121.19558068"
"桃園市楊梅區金山街1號","24.909356","121.154497"
"桃園市楊梅區雙榮段1561號","24.90767527","121.14575321"
"桃園市楊梅區快速路五段825巷17弄1號","24.949402","121.161958"
"桃園市楊梅區三民東路241號","24.907106","121.17023"
"桃園市新屋區崁頭厝段崁頭厝小段991號","24.97248034","121.10548076"
"桃園市新屋區崁頭厝段崁頭厝小段1021號","24.97248034","121.10548076"
"桃園市楊梅區上田段301號","24.90767527","121.14575321"
"桃園市楊梅區青山五街1號","24.921189","121.1715"
"桃園市楊梅區高獅路834巷1號","24.922531","121.168485"
"桃園市大園區竹圍段崁腳小段1號","25.06384279","121.19558068"
"桃園市楊梅區金龍三路1號","24.91173042","121.18651463"
"桃園市新屋區蚵殼港段深圳小段511號","24.97248034","121.10548076"
"桃園市新屋區蚵殼港段深圳小段511號","24.97248034","121.10548076"
"桃園市新屋區蚵殼港段深圳小段511號","24.97248034","121.10548076"
"桃園市龍潭區民治十六街241號","24.82314","121.23234"
"桃園市新屋區東勢段甲頭厝小段631號","24.97248034","121.10548076"
"桃園市蘆竹區長興路一段31號","25.072184","121.28798"
"桃園市蘆竹區長興路一段31號","25.072184","121.28798"
"桃園市蘆竹區南崁廟口段營盤坑小段91號","25.04693352","121.29508445"
"桃園市大園區華興段901號","25.06384279","121.19558068"
"桃園市八德區東勇街45巷1號","24.961935","121.306417"
"桃園市八德區新霄裡段31號","24.92893097","121.28463376"
"桃園市八德區豐田段1351號","24.92893097","121.28463376"
"桃園市八德區中華段811號","24.92893097","121.28463376"
"桃園市八德區仁德路151號","24.935767","121.286161"
"桃園市大園區大牛稠段大牛稠小段61號","25.06384279","121.19558068"
"桃園市大園區拔子林三路53巷17弄31號","25.078354","121.263153"
"桃園市大園區沙崙段坡堵小段361號","25.06384279","121.19558068"
"桃園市大園區沙崙里17鄰沙崙91號","25.088911","121.2159"
"桃園市蘆竹區南竹段241號","25.04693352","121.29508445"
"桃園市大園區五塊厝段下埔小段721號","25.06384279","121.19558068"
"桃園市八德區桃德段541號","24.92893097","121.28463376"
"桃園市八德區後庄91號","24.92893097","121.28463376"
"桃園市平鎮區中豐路南勢二段369巷1號","24.909929","121.211818"
"桃園市平鎮區金陵路二段1巷1號","24.943288","121.222826"
"桃園市平鎮區東金段1021號","24.94570169","121.21823451"
"桃園市八德區高城八街19巷31號","24.977172","121.275406"
"桃園市龜山區萬壽路二段1231號","24.992978","121.329122"
"桃園市龜山區山福段331號","24.99267322","121.3377571"
"桃園市龜山區山德段721號","24.99267322","121.3377571"
"桃園市龜山區民生北路一段31號","25.03142","121.3034"
"桃園市龜山區自由街8巷1號","25.018234","121.403675"
"桃園市平鎮區大興街88巷31號","24.910481","121.208289"
"桃園市龜山區頂湖段1081號","24.99267322","121.3377571"
"桃園市八德區大勇段151號","24.92893097","121.28463376"
"桃園市八德區大華段571號","24.92893097","121.28463376"
"桃園市蘆竹區大興四街91號","25.015229","121.259619"
"桃園市八德區廣興三路42巷31號","24.935213","121.284273"
"桃園市大園區竹圍段海方厝小段61號","25.06384279","121.19558068"
"桃園市大園區竹圍段海方厝小段61號","25.06384279","121.19558068"
"桃園市楊梅區頭重溪段91號","24.90767527","121.14575321"
"桃園市新屋區新屋段後湖小段631號","24.97248034","121.10548076"
"桃園市楊梅區裕成南路361號","24.899042","121.157635"
"桃園市楊梅區金龍三路1號","24.91173042","121.18651463"
"桃園市楊梅區金龍三路1號","24.91173042","121.18651463"
"桃園市楊梅區金龍三路1號","24.91173042","121.18651463"
"桃園市楊梅區金龍三路1號","24.91173042","121.18651463"
"桃園市楊梅區新富一街1號","24.936401","121.090102"
"桃園市楊梅區金龍三路1號","24.91173042","121.18651463"
"桃園市楊梅區啟明段841號","24.90767527","121.14575321"
"桃園市楊梅區環南路171巷9弄1號","24.900695","121.145506"
"桃園市大園區橫山段湳子小段151號","25.06384279","121.19558068"
"桃園市大園區內海墘段751號","25.06384279","121.19558068"
"桃園市大園區客運二段301號","25.06384279","121.19558068"
"桃園市大園區沙崙段沙崙小段571號","25.06384279","121.19558068"
"桃園市蘆竹區南山路一段31號","25.051471","121.292071"
"桃園市蘆竹區龍安街二段1531號","25.016374","121.252679"
"桃園市蘆竹區宏竹段511號","25.04693352","121.29508445"
"桃園市大園區橫山段橫山小段181號","25.06384279","121.19558068"
"桃園市大園區環區西路421號","25.050124","121.165825"
"桃園市大園區青峰段451號","25.06384279","121.19558068"
"桃園市蘆竹區坑子外段外社小段391號","25.04693352","121.29508445"
"桃園市大園區內海墘段691號","25.06384279","121.19558068"
"桃園市蘆竹區大坑段721號","25.04693352","121.29508445"
"桃園市大園區大觀路916巷85弄1號","25.059622","121.164343"
"桃園市大園區濱海路三段52巷1號","25.0848","121.190433"
"桃園市蘆竹區奉化路61號","25.039366","121.288889"
"桃園市大園區五塊厝段下埔小段871號","25.06384279","121.19558068"
"桃園市大園區田心段781號","25.06384279","121.19558068"
"桃園市大園區青山段331號","25.06384279","121.19558068"
"桃園市大園區青峰段481號","25.06384279","121.19558068"
"桃園市大園區青山段331號","25.06384279","121.19558068"
"桃園市大園區青山段331號","25.06384279","121.19558068"
"桃園市大園區埔心段三塊厝小段211號","25.06384279","121.19558068"
"桃園市蘆竹區光明路二段31號","25.04558242","121.28763963"
"桃園市八德區廣興二路91號","24.932796","121.279237"
"桃園市大園區五塊厝段下埔小段991號","25.06384279","121.19558068"
"桃園市大園區埔心段埔心小段661號","25.06384279","121.19558068"
"桃園市大園區埔心段埔心小段1441號","25.06384279","121.19558068"
"桃園市大園區大觀路1156巷6弄1號","25.055426","121.157892"
"桃園市八德區豐德路89巷55弄1號","24.924597","121.292487"
"桃園市平鎮區六和段871號","24.94570169","121.21823451"
"桃園市八德區博愛街1號","24.930259","121.296767"
"桃園市平鎮區環南路301巷1號","24.950074","121.207499"
"桃園市平鎮區廣西段781號","24.94570169","121.21823451"
"桃園市平鎮區忠貞路1號","24.930118","121.256731"
"桃園市龜山區長慶三街31號","24.99267322","121.3377571"
"桃園市龜山區體大段241號","24.99267322","121.3377571"
"桃園市龜山區萬壽路二段1411號","24.992211","121.324306"
"桃園市平鎮區中豐路山頂段469巷1號","24.894423","121.212234"
"桃園市平鎮區廣泰路232巷87弄1號","24.942338","121.202879"
"桃園市平鎮區環南段631號","24.94570169","121.21823451"
"桃園市平鎮區南平路211號","24.919838","121.206094"
"桃園市平鎮區金陵路二段408巷31號","24.933868","121.224634"
"桃園市龜山區自強段781號","24.99267322","121.3377571"
"桃園市桃園區永康街31號","25.000668","121.304948"
"桃園市桃園區天祥七街80巷1號","25.023415","121.3002"
"桃園市桃園區大興西路二段181號","25.009543","121.295848"
"桃園市桃園區小檜溪段1號","24.99387997","121.30190407"
"桃園市桃園區經國路336巷1號","25.023007","121.304254"
"桃園市桃園區福信街1號","24.99387997","121.30190407"
"桃園市觀音區仁德街31號","25.050385","121.121887"
"桃園市觀音區嘉富路1405巷1號","24.981338","121.134998"
"桃園市中壢區中園路1號","24.96466","121.236277"
"桃園市龍潭區民族路331巷1號","24.837619","121.234732"
"桃園市龍潭區民族路416巷1號","24.836287","121.233449"
"桃園市龍潭區北龍路15巷1號","24.865344","121.210348"
"桃園市龍潭區花園新城二街1號","24.83714","121.235856"
"桃園市桃園區介壽路495巷61號","24.977078","121.304632"
"桃園市龜山區長慶二街91號","25.05514142","121.38399863"
"桃園市龜山區自強南路15巷1號","24.993621","121.340864"
"桃園市龜山區海萍段751號","24.99267322","121.3377571"
"桃園市中壢區成章二街421號","24.980684","121.25573"
"桃園市中壢區成章二街421號","24.980684","121.25573"
"桃園市觀音區富源段931號","25.03653798","121.08201878"
"桃園市中壢區中工段991號","24.96563047","121.22513412"
"桃園市中壢區中原段61號","24.96563047","121.22513412"
"桃園市中壢區清泉街1號","24.94421","121.228085"
"桃園市中壢區永裕路31號","25.00729542","121.20072663"
"桃園市中壢區育樂路31號","24.964909","121.234903"
"桃園市中壢區山安路301號","25.026873","121.169018"
"桃園市中壢區西園路1號","24.971971","121.234544"
"桃園市中壢區興仁路二段27巷1號","24.968023","121.263036"
"桃園市中壢區中原段31號","24.96563047","121.22513412"
"桃園市中壢區領航南路一段61號","25.001012","121.203838"
"桃園市觀音區廣福段331號","25.03653798","121.08201878"
"桃園市大溪區民權東路151號","24.88137","121.293027"
"桃園市大溪區文化路153巷31號","24.877617","121.291839"
"桃園市大溪區文化路153巷31號","24.877617","121.291839"
"桃園市大溪區文化路153巷31號","24.877617","121.291839"
"桃園市大溪區文化路153巷31號","24.877617","121.291839"
"桃園市大溪區文化路153巷31號","24.877617","121.291839"
"桃園市大溪區文化路153巷31號","24.877617","121.291839"
"桃園市大溪區社角段1號","24.88063316","121.28702893"
"桃園市大溪區社角段1號","24.88063316","121.28702893"
"桃園市大溪區社角段361號","24.88063316","121.28702893"
"桃園市大溪區永昌段991號","24.88063316","121.28702893"
"桃園市大溪區瑞興段2161號","24.88063316","121.28702893"
"桃園市大溪區草厝江段301號","24.88063316","121.28702893"
"桃園市龍潭區高平段1891號","24.86394012","121.21629828"
"桃園市龍潭區渴望二路99巷239弄1號","24.844009","121.184826"
"桃園市大溪區華興街18巷1弄1號","24.899174","121.285102"
"桃園市楊梅區新農街541號","24.913063","121.161906"
"桃園市楊梅區民豐段331號","24.90767527","121.14575321"
"桃園市楊梅區民豐段331號","24.90767527","121.14575321"
"桃園市楊梅區民豐段331號","24.90767527","121.14575321"
"桃園市楊梅區民豐段331號","24.90767527","121.14575321"
"桃園市楊梅區民豐段331號","24.90767527","121.14575321"
"桃園市楊梅區民豐段331號","24.90767527","121.14575321"
"桃園市楊梅區金龍三路1號","24.91173042","121.18651463"
"桃園市楊梅區金龍三路1號","24.91173042","121.18651463"
"桃園市楊梅區金龍三路1號","24.91173042","121.18651463"
"桃園市楊梅區金龍三路1號","24.91173042","121.18651463"
"桃園市桃園區中山東路1號","24.995601","121.313264"
"桃園市桃園區金門三街31號","24.982076","121.313801"
"桃園市桃園區經國一路31號","25.02923","121.298683"
"桃園市桃園區經國一路1號","25.028241","121.299443"
"桃園市桃園區經國一路31號","25.02923","121.298683"
"桃園市桃園區三元街121號","25.004009","121.320349"
"桃園市桃園區春日路1259巷1號","25.016986","121.308526"
"桃園市中壢區成功路122巷91號","24.976412","121.262371"
"桃園市中壢區龍仁路31號","24.937166","121.234313"
"桃園市中壢區永平街61號","25.007506","121.203303"
"桃園市桃園區幸福路301號","25.029442","121.304613"
"桃園市桃園區幸福路301號","25.029442","121.304613"
"桃園市桃園區幸福路301號","25.029442","121.304613"
"桃園市桃園區幸福路301號","25.029442","121.304613"
"桃園市桃園區幸福路301號","25.029442","121.304613"
"桃園市桃園區幸福路301號","25.029442","121.304613"
"桃園市桃園區幸福路301號","25.029442","121.304613"
"桃園市桃園區幸福路301號","25.029442","121.304613"
"桃園市桃園區幸福路301號","25.029442","121.304613"
"桃園市桃園區幸福路301號","25.029442","121.304613"
"桃園市桃園區幸福路301號","25.029442","121.304613"
"桃園市桃園區幸福路271號","25.029442","121.304613"
"桃園市桃園區幸福路301號","25.029442","121.304613"
"桃園市桃園區幸福路301號","25.029442","121.304613"
"桃園市桃園區大興西路二段139巷151號","25.00887","121.298443"
"桃園市桃園區民富二街1號","25.00579042","121.31978263"
"桃園市桃園區福山街32巷2弄1號","25.013093","121.310572"
"桃園市桃園區長春路31號","25.000652","121.305566"
"桃園市桃園區大德三街121號","25.016773","121.317475"
"桃園市桃園區大德三街91號","25.016773","121.317475"
"桃園市桃園區同德十街31號","25.018266","121.293759"
