"addr","lat","long"
"桃園市平鎮區高雙路1號","24.9583","121.192016"
"桃園市平鎮區環南路二段1號","24.944691","121.209037"
"桃園市八德區廣興五街91號","24.933683","121.279166"
"桃園市八德區公園路91號","24.967091","121.297512"
"桃園市八德區豐田一路121號","24.926295","121.284553"
"桃園市八德區金和路31號","24.95480659","121.29750449"
"桃園市蘆竹區奉化路211號","25.037831","121.29178"
"桃園市蘆竹區坑子口段頭前小段151號","25.04693352","121.29508445"
"桃園市大園區埔心段三塊厝小段451號","25.06384279","121.19558068"
"桃園市大園區港口段151號","25.06384279","121.19558068"
"桃園市大園區港口段31號","25.06384279","121.19558068"
"桃園市蘆竹區南竹段271號","25.04693352","121.29508445"
"桃園市蘆竹區中正路1號","25.040718","121.295284"
"桃園市蘆竹區福興段361號","25.04693352","121.29508445"
"桃園市蘆竹區南竹段631號","25.04693352","121.29508445"
"桃園市大園區中華路1號","25.066081","121.197235"
"桃園市蘆竹區南昌路282巷1號","25.039268","121.292828"
"桃園市大園區五塊厝段下埔小段901號","25.06384279","121.19558068"
"桃園市蘆竹區新南路一段31號","25.046062","121.294506"
"桃園市大園區竹圍段拔子林小段181號","25.06384279","121.19558068"
"桃園市大園區中山南路一段78巷31號","25.050117","121.208524"
"桃園市蘆竹區坑子口段頭前小段151號","25.04693352","121.29508445"
"桃園市大園區竹圍段海方厝小段61號","25.06384279","121.19558068"
"桃園市大園區公園路一段61號","25.004243","121.210569"
"桃園市大園區竹圍街31號","25.105198","121.243646"
"桃園市蘆竹區蘆興段721號","25.04693352","121.29508445"
"桃園市大園區華興段721號","25.06384279","121.19558068"
"桃園市蘆竹區南福街31號","25.041561","121.291866"
"桃園市大園區五塊厝段下埔小段991號","25.06384279","121.19558068"
"桃園市大園區竹圍段崁下小段1號","25.06384279","121.19558068"
"桃園市大園區埔心段海豐坡小段271號","25.06384279","121.19558068"
"桃園市大園區竹圍段三塊石小段1531號","25.06384279","121.19558068"
"桃園市大園區拔子林一路211號","25.076412","121.26440373"
"桃園市大園區拔子林一路211號","25.076412","121.26440373"
"桃園市大園區拔子林一路211號","25.076412","121.26440373"
"桃園市大園區埔心段海豐坡小段841號","25.06384279","121.19558068"
"桃園市蘆竹區大華街201巷1號","25.043068","121.258508"
"桃園市大園區沙崙段後厝小段691號","25.06384279","121.19558068"
"桃園市大園區沙崙段後厝小段691號","25.06384279","121.19558068"
"桃園市大園區沙崙段沙崙小段31號","25.06384279","121.19558068"
"桃園市大園區橫山段橫山小段31號","25.06384279","121.19558068"
"桃園市楊梅區秀才段1321號","24.90767527","121.14575321"
"桃園市楊梅區金山街275巷31號","24.911067","121.160813"
"桃園市楊梅區民富路一段366巷16弄1號","24.921596","121.127686"
"桃園市楊梅區永寧路1巷31號","24.902664","121.147262"
"桃園市大園區沙崙里15鄰沙崙1號","25.06384279","121.19558068"
"桃園市新屋區頭洲段991號","24.97248034","121.10548076"
"桃園市新屋區中正段361號","24.97248034","121.10548076"
"桃園市楊梅區草湳坡段埔心小段1號","24.90767527","121.14575321"
"桃園市蘆竹區南崁廟口段羊稠坑小段331號","25.04693352","121.29508445"
"桃園市大園區埔心段埔心小段1471號","25.06384279","121.19558068"
"桃園市蘆竹區南崁下段571號","25.04693352","121.29508445"
"桃園市大園區埔心段埔心小段631號","25.06384279","121.19558068"
"桃園市八德區高城八街61號","24.977982","121.273893"
"桃園市八德區東勇街69巷1號","24.962691","121.306476"
"桃園市大園區園九街1號","25.05309","121.175537"
"桃園市大園區沙崙段埔頂小段61號","25.06384279","121.19558068"
"桃園市大園區五塊厝段下埔小段391號","25.06384279","121.19558068"
"桃園市平鎮區中正三路61號","24.928096","121.255789"
"桃園市平鎮區忠貞段361號","24.94570169","121.21823451"
"桃園市平鎮區忠貞段361號","24.94570169","121.21823451"
"桃園市平鎮區忠貞段361號","24.94570169","121.21823451"
"桃園市龜山區萬壽路一段369巷1號","25.01645342","121.40138463"
"桃園市龜山區楓義段1171號","24.99267322","121.3377571"
"桃園市蘆竹區六福路211號","25.060197","121.296698"
"桃園市八德區富城街1號","24.975313","121.27216"
"桃園市大園區埔心段三塊厝小段721號","25.06384279","121.19558068"
"桃園市蘆竹區八股段931號","25.04693352","121.29508445"
"桃園市大園區五塊厝段下埔小段781號","25.06384279","121.19558068"
"桃園市大園區高鐵南路一段31號","25.011935","121.212419"
"桃園市大園區大牛稠段倒厝子小段541號","25.06384279","121.19558068"
"桃園市大園區五塊厝段下埔小段1201號","25.06384279","121.19558068"
"桃園市龍潭區聖德街57巷1號","24.885423","121.203259"
"桃園市楊梅區中山北路一段199巷1號","24.906538","121.155475"
"桃園市楊梅區中山北路二段265巷32弄1號","24.909799","121.173891"
"桃園市楊梅區青山三街61號","24.919713","121.17157"
"桃園市新屋區崁頭厝段崁頭厝小段961號","24.97248034","121.10548076"
"桃園市楊梅區長紅段721號","24.90767527","121.14575321"
"桃園市楊梅區環南路162巷1號","24.90155","121.1457"
"桃園市楊梅區環南路109巷1號","24.901329","121.146901"
"桃園市新屋區下田心子段赤牛欄小段1831號","24.97248034","121.10548076"
"桃園市新屋區石牌嶺段661號","24.97248034","121.10548076"
"桃園市楊梅區民生段751號","24.90767527","121.14575321"
"桃園市新屋區石牌嶺段1381號","24.97248034","121.10548076"
"桃園市楊梅區楊富段1141號","24.90767527","121.14575321"
"桃園市大園區埔心段海豐坡小段211號","25.06384279","121.19558068"
"桃園市蘆竹區宏昌段511號","25.04693352","121.29508445"
"桃園市蘆竹區大興十街91號","25.021446","121.255106"
"桃園市蘆竹區八股段1051號","25.04693352","121.29508445"
"桃園市大園區大牛稠段倒厝子小段631號","25.06384279","121.19558068"
"桃園市大園區青昇路一段132巷186弄1號","25.010719","121.226113"
"桃園市大園區園航路391號","25.05725","121.175634"
"桃園市蘆竹區海山路二段海寧巷6弄1號","25.107606","121.255563"
"桃園市大園區埔心段埔心小段601號","25.06384279","121.19558068"
"桃園市大園區五塊厝段大埔小段1591號","25.06384279","121.19558068"
"桃園市大園區五塊厝段大埔小段1591號","25.06384279","121.19558068"
"桃園市大園區五塊厝段大埔小段1591號","25.06384279","121.19558068"
"桃園市大園區大觀路600巷12弄1號","25.062992","121.175968"
"桃園市大園區沙崙段後厝小段691號","25.06384279","121.19558068"
"桃園市大園區竹圍段三塊石小段421號","25.06384279","121.19558068"
"桃園市大園區五塊厝段下埔小段631號","25.06384279","121.19558068"
"桃園市大園區埔心段海豐坡小段571號","25.06384279","121.19558068"
"桃園市大園區五塊厝段下埔小段871號","25.06384279","121.19558068"
"桃園市大園區埔心段埔心小段1261號","25.06384279","121.19558068"
"桃園市大園區和平西路67巷1號","25.057721","121.198179"
"桃園市大園區埔心段埔心小段1891號","25.06384279","121.19558068"
"桃園市大園區竹圍段三塊石小段271號","25.06384279","121.19558068"
"桃園市大園區和平西路二段682巷31號","25.027843","121.181367"
"桃園市蘆竹區八股段691號","25.04693352","121.29508445"
"桃園市大園區三石里6鄰三塊石31號","25.064693","121.249017"
"桃園市大園區福德路178巷30弄1號","25.07525","121.256012"
"桃園市大園區大牛稠段大牛稠小段1號","25.06384279","121.19558068"
"桃園市大園區埔心段埔心小段1561號","25.06384279","121.19558068"
"桃園市大園區竹圍段竹圍小段181號","25.06384279","121.19558068"
"桃園市蘆竹區坑子口段頭前小段151號","25.04693352","121.29508445"
"桃園市大園區橫山段尖山小段61號","25.06384279","121.19558068"
"桃園市大園區竹圍街121號","25.105208","121.243534"
"桃園市大園區溪海路153巷1號","25.035061","121.19174323"
"桃園市八德區中正一路121號","24.930138","121.283159"
"桃園市八德區大智段841號","24.92893097","121.28463376"
"桃園市八德區廣福路20巷1號","24.958793","121.29876"
"桃園市八德區中正一路121號","24.930138","121.283159"
"桃園市八德區豐田一路31號","24.9262057","121.2890575"
"桃園市平鎮區六和段901號","24.94570169","121.21823451"
"桃園市平鎮區六和段751號","24.94570169","121.21823451"
"桃園市平鎮區民族路二段23巷1號","24.956916","121.207729"
"桃園市平鎮區文化街271號","24.951016","121.203656"
"桃園市平鎮區東安段481號","24.94570169","121.21823451"
"桃園市平鎮區建安路236巷121號","24.917299","121.237481"
"桃園市平鎮區山子頂段151號","24.94570169","121.21823451"
"桃園市龜山區光路千禧新城1號","24.99267322","121.3377571"
"桃園市龜山區宏慶街31號","25.018835","121.410118"
"桃園市龜山區明德路241號","24.991024","121.342717"
"桃園市平鎮區六和段751號","24.94570169","121.21823451"
"桃園市平鎮區六和段931號","24.94570169","121.21823451"
"桃園市中壢區仁愛段1141號","24.96563047","121.22513412"
"桃園市中壢區仁愛段1141號","24.96563047","121.22513412"
"桃園市觀音區藍埔段2131號","25.03653798","121.08201878"
"桃園市中壢區徐州街1號","24.950237","121.235316"
"桃園市中壢區大江段1號","24.96563047","121.22513412"
"桃園市大溪區三層段柑坪小段1號","24.88063316","121.28702893"
"桃園市大溪區三層段柑坪小段1號","24.88063316","121.28702893"
"桃園市大溪區石屯段上石屯小段1號","24.88063316","121.28702893"
"桃園市大溪區僑愛一街72巷16弄1號","24.922427","121.29388"
"桃園市大溪區半屏段271號","24.88063316","121.28702893"
"桃園市大溪區溪崁段1111號","24.88063316","121.28702893"
"桃園市桃園區溫州街61號","25.00688","121.2974"
"桃園市桃園區中埔六街1號","25.015397","121.296443"
"桃園市桃園區南平路254巷1號","25.019293","121.300303"
"桃園市桃園區大業路一段31號","25.004022","121.318058"
"桃園市桃園區桃鶯路361號","24.980767","121.31977"
"桃園市桃園區莊敬路二段181號","25.021351","121.291157"
"桃園市桃園區龍壽段421號","24.99387997","121.30190407"
"桃園市桃園區中正路1381號","25.023957","121.294617"
"桃園市龜山區文化三路1巷61號","25.061723","121.361801"
"桃園市桃園區永樂街61號","24.996905","121.310935"
"桃園市龜山區大同路236巷31號","24.989956","121.344299"
"桃園市龜山區幸福十七街1號","24.985967","121.336813"
"桃園市龜山區幸福七街1號","24.986304","121.335054"
"桃園市龜山區振興路58巷3弄1號","25.00351","121.350944"
"桃園市龜山區振興路58巷2弄1號","25.0033","121.350872"
"桃園市龜山區長慶三街1號","24.99267322","121.3377571"
"桃園市龜山區文化三路61號","25.059245","121.363008"
"桃園市中壢區青溪段211號","24.96563047","121.22513412"
"桃園市中壢區榮安十五街35巷1號","24.961294","121.258996"
"桃園市中壢區文發路151號","25.002301","121.209003"
"桃園市中壢區百韜二街52巷1號","24.943971","121.227674"
"桃園市中壢區復華八街1號","24.971234","121.246867"
"桃園市中壢區新中北路二段170巷61號","24.954471","121.263345"
"桃園市中壢區仁祥段1051號","24.96563047","121.22513412"
"桃園市中壢區執信一街151號","24.945301","121.22772"
"桃園市中壢區青商路121號","25.00651","121.217689"
"桃園市中壢區啟文段721號","24.96563047","121.22513412"
"桃園市中壢區普義路217巷1號","24.961397","121.230865"
"桃園市觀音區福德街271號","25.04507342","121.13663763"
"桃園市中壢區精忠二街1號","24.97126","121.25617"
"桃園市觀音區濱海段931號","25.03653798","121.08201878"
"桃園市中壢區大路段601號","24.96563047","121.22513412"
"桃園市觀音區大湖路二段387巷1號","25.003066","121.128826"
"桃園市中壢區中北段151號","24.96563047","121.22513412"
"桃園市中壢區福州一街241號","24.967347","121.232892"
"桃園市中壢區中央西路二段192巷1號","24.959536","121.213088"
"桃園市大溪區瑞興段1441號","24.88063316","121.28702893"
"桃園市龍潭區中豐路461巷106弄61號","24.883774","121.20932"
"桃園市龍潭區大平段451號","24.86394012","121.21629828"
"桃園市龍潭區健行段121號","24.86394012","121.21629828"
"桃園市大溪區大綸31號","24.923479","121.296805"
"桃園市龍潭區德林路121巷37弄1號","24.882356","121.201851"
"桃園市龍潭區渴望二路99巷241號","24.843918","121.184902"
"桃園市楊梅區二重溪段1號","24.90767527","121.14575321"
"桃園市楊梅區楊新北路211號","24.911137","121.156147"
"桃園市楊梅區楊新北路381巷2弄1號","24.912276","121.15588"
"桃園市新屋區長祥段91號","24.97248034","121.10548076"
"桃園市楊梅區高雙段241號","24.90767527","121.14575321"
"桃園市楊梅區永美路401巷61號","24.913486","121.180598"
"桃園市楊梅區東森路91號","24.888504","121.164802"
"桃園市桃園區幸福路271號","25.029442","121.304613"
"桃園市桃園區大有路541號","25.014831","121.317133"
"桃園市中壢區自強一路91號","24.976334","121.244312"
"桃園市中壢區溪洲街241號","24.961108","121.2292"
"桃園市觀音區公園三街13巷1號","24.970321","121.146456"
"桃園市中壢區高鐵南路三段727巷91號","24.987207","121.192244"
"桃園市中壢區雙嶺段1441號","24.96563047","121.22513412"
"桃園市中壢區雙嶺段1441號","24.96563047","121.22513412"
"桃園市中壢區雙嶺段1441號","24.96563047","121.22513412"
"桃園市中壢區龍川四街31號","24.936903","121.245868"
"桃園市中壢區大仁二街1號","24.954449","121.242134"
"桃園市觀音區永吉街61號","25.050082","121.11968"
"桃園市桃園區幸福路271號","25.029442","121.304613"
"桃園市桃園區幸福路271號","25.029442","121.304613"
"桃園市桃園區幸福路271號","25.029442","121.304613"
"桃園市桃園區幸福路271號","25.029442","121.304613"
"桃園市桃園區文中東路61號","24.996041","121.296714"
"桃園市桃園區漢中路91號","24.980781","121.303862"
"桃園市桃園區國強一街168巷31號","24.993645","121.284857"
"桃園市桃園區和平段571號","24.99387997","121.30190407"
"桃園市桃園區文中路47巷1號","24.995641","121.293735"
"桃園市桃園區經國路1號","25.00887","121.31084"
"桃園市桃園區永安路765巷1號","25.007514","121.290536"
"桃園市桃園區中正路1381號","25.023957","121.294617"
"桃園市桃園區文中東路61號","24.996041","121.296714"
"桃園市桃園區大興西路二段139巷151號","25.00887","121.298443"
"桃園市桃園區慈文路871號","25.000764","121.291351"
"桃園市桃園區龍壽街86巷1號","24.980696","121.269373"
"桃園市桃園區中正五街181號","25.005259","121.301495"
"桃園市桃園區文中三路61號","24.99736942","121.28863463"
"桃園市桃園區同德六街151號","25.01532","121.296851"
"桃園市桃園區龍泉六街1號","24.983543","121.270836"
"桃園市桃園區大有路511號","25.014218","121.317457"
"桃園市桃園區大樹林段661號","24.99387997","121.30190407"
"桃園市桃園區幸福路151號","25.029442","121.304613"
"桃園市桃園區富國路681巷19弄1號","25.020916","121.280623"
"桃園市桃園區文中三路1號","24.99387997","121.30190407"
"桃園市桃園區大仁路1號","24.973763","121.324278"
"桃園市桃園區保定三街89巷31號","24.99694042","121.29828163"
"桃園市桃園區埔子段北門埔子小段61號","24.99387997","121.30190407"
"桃園市桃園區和平段541號","24.99387997","121.30190407"
"桃園市桃園區玉山街52巷1號","24.989657","121.300816"
"桃園市桃園區樹仁三街131巷26弄1號","24.973807","121.32048"
"桃園市桃園區寶山街181號","25.01244","121.316951"
"桃園市桃園區永安路1188巷1弄1號","25.010723","121.280793"
"桃園市桃園區莊敬路二段121號","25.022207","121.292246"
"桃園市桃園區幸福路271號","25.029442","121.304613"
"桃園市桃園區幸福路271號","25.029442","121.304613"
"桃園市桃園區幸福路301號","25.029442","121.304613"
"桃園市桃園區幸福路301號","25.029442","121.304613"
"桃園市桃園區幸福路301號","25.029442","121.304613"
"桃園市桃園區幸福路301號","25.029442","121.304613"
"桃園市桃園區幸福路301號","25.029442","121.304613"
"桃園市桃園區幸福路301號","25.029442","121.304613"
"桃園市中壢區大智街1號","24.953305","121.241122"
"桃園市中壢區華美三路301號","24.947104","121.259588"
"桃園市中壢區華美三路331號","24.94653342","121.25895263"
"桃園市中壢區復華七街1號","24.969606","121.246856"
"桃園市中壢區中興段91號","24.96563047","121.22513412"
"桃園市觀音區安和街241號","25.05316142","121.12300363"
"桃園市中壢區協同街31號","24.953688","121.23933"
"桃園市中壢區環北路151號","24.966759","121.220972"
"桃園市中壢區華美三路301號","24.947104","121.259588"
"桃園市中壢區華美三路301號","24.947104","121.259588"
"桃園市中壢區華美三路301號","24.947104","121.259588"
"桃園市中壢區華美三路331號","24.94653342","121.25895263"
"桃園市中壢區華美三路331號","24.94653342","121.25895263"
"桃園市中壢區華美三路301號","24.947104","121.259588"
"桃園市中壢區華美三路301號","24.947104","121.259588"
"桃園市中壢區領航南路四段31號","25.015711","121.220949"
"桃園市中壢區領航南路四段31號","25.015711","121.220949"
"桃園市桃園區經國路393巷1號","25.01661","121.30498"
"桃園市桃園區福林街31號","24.974785","121.303403"
"桃園市桃園區民生路301號","24.997592","121.311551"
"桃園市桃園區經國路61號","25.026542","121.301017"
"桃園市桃園區大興西路二段1號","25.012014","121.299958"
"桃園市桃園區同德六街158巷1號","25.015799","121.297023"
"桃園市桃園區民生路661號","25.00747","121.308022"
"桃園市桃園區復興路151號","24.98982","121.3113"
"桃園市桃園區大業路一段421號","25.014862","121.311547"
"桃園市桃園區民富十三街1號","25.012494","121.320319"
"桃園市桃園區天祥一街61號","25.011564","121.305618"
"桃園市楊梅區四維路151號","24.912127","121.182209"
"桃園市楊梅區環南路141巷11弄1號","24.900916","121.146397"
"桃園市楊梅區文化街568巷1號","24.906562","121.178153"
"桃園市楊梅區金龍三路1號","24.91173042","121.18651463"
"桃園市楊梅區金龍三路1號","24.91173042","121.18651463"
"桃園市新屋區中山西路二段800巷31號","24.98372742","121.05912663"
"桃園市楊梅區中山北路二段87巷2弄31號","24.907789","121.168775"
"桃園市新屋區社子段601號","24.97248034","121.10548076"
"桃園市新屋區中山西路二段800巷31號","24.98372742","121.05912663"
"桃園市新屋區中山西路二段800巷31號","24.98372742","121.05912663"
"桃園市新屋區榔段上號","24.97248034","121.10548076"
"桃園市大溪區草厝江段1號","24.88063316","121.28702893"
"桃園市龍潭區干城路211號","24.873187","121.20967"
"桃園市龍潭區和原段2401號","24.86394012","121.21629828"
"桃園市龍潭區竹龍段601號","24.86394012","121.21629828"
"桃園市大溪區仁善段1351號","24.88063316","121.28702893"
"桃園市大溪區文化路153巷31號","24.877617","121.291839"
"桃園市大溪區文化路153巷31號","24.877617","121.291839"
"桃園市中壢區興南段公坡小段541號","24.96563047","121.22513412"
"桃園市龍潭區民治一街47巷1號","24.825037","121.237275"
"桃園市中壢區龍岡路三段154巷1號","24.935917","121.233111"
"桃園市觀音區安和街121號","25.051345","121.120291"
"桃園市中壢區民族路五段328巷1號","24.958628","121.169757"
"桃園市中壢區中山東路一段223巷89弄1號","24.958271","121.23635"
"桃園市中壢區五光二街1號","24.959243","121.211014"
"桃園市中壢區強國路61號","24.967639","121.258352"
"桃園市中壢區青埔四街61號","25.005497","121.219766"
"桃園市中壢區萬能段61號","24.96563047","121.22513412"
"桃園市中壢區普騰街26巷1號","24.963767","121.256013"
"桃園市中壢區內壢段1771號","24.96563047","121.22513412"
"桃園市中壢區興仁路二段648巷1號","24.957422","121.264427"
"桃園市觀音區福壽街1號","25.053644","121.121574"
"桃園市中壢區後寮一路271號","24.937131","121.246504"
"桃園市中壢區中山東路一段91巷23弄1號","24.956776","121.230818"
"桃園市觀音區金湖段691號","25.03653798","121.08201878"
"桃園市中壢區龍岡路三段今日新村31號","24.938099","121.231312"
"桃園市觀音區草豊段31號","25.03653798","121.08201878"
"桃園市中壢區環北路541號","24.964642","121.22914"
"桃園市中壢區青平段61號","24.96563047","121.22513412"
"桃園市中壢區中北段1141號","24.96563047","121.22513412"
"桃園市中壢區中北段1141號","24.96563047","121.22513412"
"桃園市中壢區力行北街121號","24.955873","121.238127"
"桃園市中壢區忠福段1951號","24.96563047","121.22513412"
"桃園市中壢區中壢埔頂段1321號","24.96563047","121.22513412"
"桃園市中壢區中平路161151號","24.956313","121.221036"
"桃園市觀音區工業區段二小段31號","25.03653798","121.08201878"
"桃園市觀音區莊敬路361號","25.04676442","121.13671263"
"桃園市觀音區莊敬路61號","25.041537","121.134595"
"桃園市龜山區文山街37巷1號","25.056153","121.380745"
"桃園市龜山區文昌三街91號","25.056754","121.368864"
"桃園市龜山區舊路坑二段631號","24.99267322","121.3377571"
"桃園市桃園區大仁路48巷1號","24.972733","121.323138"
"桃園市桃園區大仁路40巷1弄1號","24.97293","121.323215"
"桃園市桃園區介壽路495巷61號","24.977078","121.304632"
"桃園市桃園區介壽路495巷61號","24.977078","121.304632"
"桃園市桃園區介壽路495巷61號","24.977078","121.304632"
"桃園市桃園區介壽路495巷61號","24.977078","121.304632"
"桃園市桃園區介壽路495巷61號","24.977078","121.304632"
"桃園市桃園區介壽路495巷61號","24.977078","121.304632"
"桃園市桃園區樹仁三街15巷1號","24.974716","121.323388"
"桃園市龍潭區富林段241號","24.86394012","121.21629828"
"桃園市中壢區大江段1號","24.96563047","121.22513412"
"桃園市中壢區青商路301號","25.012742","121.222709"
"桃園市中壢區領航南路四段1號","25.017886","121.223897"
"桃園市桃園區春日路658巷1號","25.01031","121.31155"
"桃園市桃園區寶慶路121號","25.017859","121.290584"
"桃園市桃園區天祥五街1號","25.018664","121.304134"
"桃園市平鎮區大勇街和平巷1號","24.928717","121.223171"
"桃園市龜山區長峰路61號","25.002139","121.341047"
"桃園市龜山區頂興路37巷2弄1號","24.990561","121.328985"
"桃園市平鎮區賦梅路680巷1號","24.93417","121.195231"
"桃園市平鎮區賦梅路680巷1號","24.93417","121.195231"
"桃園市平鎮區長安路3巷1號","24.956262","121.196037"
"桃園市平鎮區游泳路91號","24.927991","121.23658"
"桃園市平鎮區上海路89巷1號","24.910588","121.206265"
"桃園市平鎮區上海路211號","24.91527","121.206165"
"桃園市平鎮區中豐路山頂段1巷31號","24.905192","121.212011"
"桃園市平鎮區南平路121巷54弄1號","24.917574","121.20772"
"桃園市平鎮區延平路二段1號","24.95033","121.214651"
"桃園市八德區福興段1號","24.92893097","121.28463376"
"桃園市八德區銀和街71巷1號","24.956524","121.297548"
"桃園市八德區明光街49巷1號","24.982991","121.279502"
"桃園市大園區沙崙段後厝小段601號","25.06384279","121.19558068"
"桃園市大園區竹圍段三塊石小段1411號","25.06384279","121.19558068"
"桃園市八德區榮興路868巷1號","24.939777","121.304922"
"桃園市八德區高城六街61號","24.978752","121.273688"
"桃園市大園區華興路二段478巷61號","25.028566","121.201545"
"桃園市大園區和平西路一段53巷1號","25.052066","121.192524"
"桃園市大園區華興路二段478巷61號","25.028566","121.201545"
"桃園市大園區埔心段埔心小段1471號","25.06384279","121.19558068"
"桃園市蘆竹區忠孝西路182巷31號","25.040053","121.28841"
"桃園市大園區埔心段埔心小段1081號","25.06384279","121.19558068"
"桃園市蘆竹區坑子口段頭前小段211號","25.04693352","121.29508445"
"桃園市大園區埔心段埔心小段751號","25.06384279","121.19558068"
"桃園市大園區五青路382巷91號","25.021131","121.230434"
"桃園市大園區五青路382巷91號","25.021131","121.230434"
"桃園市大園區五青路382巷91號","25.021131","121.230434"
"桃園市大園區埔心段海豐坡小段361號","25.06384279","121.19558068"
"桃園市大園區華興路二段478巷61號","25.028566","121.201545"
"桃園市大園區溪海段601號","25.06384279","121.19558068"
"桃園市大園區大牛稠段大牛稠小段751號","25.06384279","121.19558068"
