鄉鎮市區,交易標的,土地區段位置建物區段門牌,土地面積平方公尺,都市土地使用分區,非都市土地使用分區,非都市土地使用編定,租賃年月日,租賃筆棟數,租賃層次,總樓層數,建物型態,主要用途,主要建材,建築完成年月,建物總面積平方公尺,建物現況格局-房,建物現況格局-廳,建物現況格局-衛,建物現況格局-隔間,有無管理組織,有無附傢俱,總額元,單價元平方公尺,車位類別,車位面積平方公尺,車位總額元,備註,編號
The villages and towns urban district,transaction sign,land sector position building sector house number plate,land shifting total area square meter,the use zoning or compiles and checks,the non-metropolis land use district,non-metropolis land use,transaction year month and day,transaction pen number,shifting level,total floor number,building state,main use,main building materials,construction to complete the years,building shifting total area,Building present situation pattern - room,building present situation pattern - hall,building present situation pattern - health,building present situation pattern - compartmented,Whether there is manages the organization,Whether there is attaches the furniture,total price NTD,the unit price (NTD / square meter),the berth category,berth shifting total area square meter,the berth total price NTD,the note,serial number
內湖區,建物,臺北市內湖區行善路31~60號,0.0,住,,,1090717,土地0建物1車位0,四層,9,華廈(10層含以下有電梯),住家用,鋼筋混凝土造,0870506,124.08,3,2,2,有,有,有,26000,210,,0.0,0,,RPXOMLLLPHPFFCA98CC
內湖區,建物,臺北市內湖區內湖路一段31~60號,0.0,住,,,1090706,土地0建物0車位0,二層,5,公寓(5樓含以下無電梯),住家用,鋼筋混凝土造,0780920,60.45,2,1,1,有,無,有,31000,513,,0.0,0,第2層共分成19間，一房平均面積約為30.23平方公尺，兩房平均面積約為60.45平方公尺,RPOPMLLLPHPFFCA18CC
內湖區,建物,臺北市內湖區內湖路一段31~60號,0.0,住,,,1090713,土地0建物0車位0,二層,5,公寓(5樓含以下無電梯),住家用,鋼筋混凝土造,0780920,60.45,2,1,1,有,無,有,27300,452,,0.0,0,第2層共分成19間，一房平均面積約為30.23平方公尺，兩房平均面積約為60.45平方公尺,RPPPMLLLPHPFFCA28CC
內湖區,建物,臺北市內湖區民權東路六段1~30號,0.0,工,,,1090623,土地0建物1車位1,二層,7,廠辦,見其他登記事項,鋼筋混凝土造,0980327,1453.4299999999998,0,0,0,無,有,無,357000,246,坡道平面,31.24,0,,RPTQMLLLPHPFFCA78CC
中山區,建物,臺北市中山區民生東路三段31~60號,0.0,商,,,1090623,土地0建物1車位0,十三層,16,辦公商業大樓,商業用,鋼筋混凝土造,0750412,841.18,0,0,0,無,有,無,509050,605,,0.0,0,,RPVQMLLLPHPFFCA98CC
中山區,建物,臺北市中山區建國北路三段121~150號,0.0,商,,,1090630,土地0建物1車位0,一層,8,店面(店鋪),商業用,鋼筋混凝土造,0780123,122.73,0,0,0,無,無,無,48814,398,,0.0,0,,RPURMLLLPHPFFCA98CC
內湖區,建物,臺北市內湖區洲子街61~90號,0.0,工,,,1090701,土地0建物1車位0,一層,10,廠辦,工業用,鋼筋混凝土造,0871029,250.5,0,0,0,無,有,無,204336,816,,0.0,0,,RPQSMLLLPHPFFCA68CC
中山區,建物,臺北市中山區農安街1~30號,0.0,商,,,1090703,土地0建物1車位0,四層,12,住宅大樓(11層含以上有電梯),商業用,鋼筋混凝土造,0890501,136.32,2,2,1,有,有,有,39000,286,,0.0,0,,RPOTMLLLPHPFFCA58CC
大同區,建物,臺北市大同區市民大道一段181~210號,0.0,其他,,,1090701,土地0建物1車位0,九層,18,住宅大樓(11層含以上有電梯),住家用,見其他登記事項,0980724,79.91,1,1,1,有,有,有,45000,563,,0.0,0,租賃範圍不含車位，且無法區分車位面積。;含管理費、稅金或水電等費用。;,RPTNMLLLPHPFFBA38CC
中正區,房地(土地+建物),臺北市中正區許昌街31~60號,159.99,商,,,1090713,土地3建物1車位0,九層,11,住宅大樓(11層含以上有電梯),,鋼筋混凝土造,,846.88,0,1,3,有,有,有,330000,390,,0.0,0,,RPROMLLLPHPFFBA28CC
大同區,車位,臺北市大同區南京西路18巷1~30號,0.0,商,,,1090718,土地0建物0車位1,,0,其他,見其他登記事項,鋼筋混凝土造,1001129,6.84,0,0,0,有,有,無,3500,,塔式車位,0.0,3500,續租。;租金含管理費,RPTOMLLLPHPFFBA48CC
信義區,建物,臺北市信義區忠孝東路五段481~510號,0.0,住,,,1090624,土地0建物1車位0,十層,17,住宅大樓(11層含以上有電梯),商業用,鋼骨鋼筋混凝土造,0820514,86.56,0,0,0,無,無,無,35000,404,,0.0,0,,RPROMLLLPHPFFDA48CC
信義區,建物,臺北市信義區忠孝東路五段481~510號,0.0,住,,,1090708,土地0建物1車位0,十層,27,辦公商業大樓,商業用,鋼骨混凝土造,0820813,195.38,1,1,1,有,有,無,90000,461,,0.0,0,,RPTOMLLLPHPFFDA68CC
信義區,建物,臺北市信義區基隆路一段421~450號,0.0,商,,,1090703,土地0建物1車位0,一層,15,店面(店鋪),商業用,鋼筋混凝土造,,118.08,0,0,0,無,有,無,80000,678,,0.0,0,,RPWOMLLLPHPFFDA98CC
松山區,建物,臺北市松山區南京東路三段271~300號,0.0,商,,,1090721,土地0建物0車位0,十層,14,辦公商業大樓,商業用,鋼筋混凝土造,0750923,130.38,2,0,2,有,有,有,80000,614,,0.0,0,,RPQPMLLLPHPFFDA48CC
南港區,建物,臺北市南港區園區街1~30號,0.0,其他,,,1090629,土地0建物1車位4,十層,21,廠辦,見其他登記事項,見其他登記事項,0920530,687.79,0,0,0,無,有,無,280800,408,坡道平面,142.5,0,,RPPQMLLLPHPFFDA48CC
北投區,建物,臺北市北投區西安街一段271~300號,0.0,商,,,1090628,土地0建物1車位0,一層,4,店面(店鋪),商業用,鋼筋混凝土造,0641022,87.57,0,1,1,有,無,無,40000,457,,0.0,0,,RPRNMLLLPHPFFEA48CC
士林區,建物,臺北市士林區福華路1~30號,0.0,住,,,1090622,土地0建物1車位1,六層,9,華廈(10層含以下有電梯),住家用,鋼筋混凝土造,1070709,154.97,3,2,2,有,有,有,40856,264,升降平面,37.8,0,,RPVNMLLLPHPFFEA88CC
北投區,建物,臺北市北投區實踐街61~90號,0.0,住,,,1090701,土地0建物1車位0,一層,8,店面(店鋪),商業用,鋼筋混凝土造,0831102,35.16,0,1,1,有,無,無,25000,711,,0.0,0,,RPSOMLLLPHPFFEA68CC
士林區,建物,臺北市士林區福華路121~150號,0.0,住,,,1090717,土地0建物1車位0,二層,4,公寓(5樓含以下無電梯),住家用,鋼筋混凝土造,0610623,94.01,3,2,1,有,無,有,29500,314,,0.0,0,,RPXOMLLLPHPFFEA56CC
北投區,建物,臺北市北投區明德路331巷31~60號,33.82,商,,,1090710,土地0建物1車位0,一層,5,公寓(5樓含以下無電梯),住家用,鋼筋混凝土造,0690408,145.85,4,2,2,有,無,無,32000,219,,0.0,0,,RPTPMLLLPHPFFEA88CC
士林區,建物,臺北市士林區承德路四段331~360號,0.0,住,,,1090709,土地0建物0車位0,五層,5,套房(1房1廳1衛),住家用,鋼筋混凝土造,0700820,38.89,1,0,1,有,無,有,13300,342,,0.0,0,,RPQQMLLLPHPFFEA68CC
大安區,車位,臺北市大安區和平東路一段75巷61~90號,0.0,,,,1090623,土地0建物0車位1,,12,其他,見使用執照,鋼筋混凝土造,0751224,34.64,0,0,0,有,有,無,4000,,升降平面,34.64,4000,,RPUNMLLLPHPFFFA88CC
大安區,車位,臺北市大安區和平東路一段91~120號,0.0,,,,1090629,土地0建物0車位1,,18,其他,停車空間,鋼筋混凝土造,0860702,38.24,0,0,0,有,有,無,6400,,坡道平面,38.24,6400,,RPVNMLLLPHPFFFA98CC
大安區,建物,臺北市大安區忠孝東路三段217巷4弄1~30號,0.0,住,,,1090702,土地0建物1車位0,七層,7,華廈(10層含以下有電梯),住家用,鋼筋混凝土造,,152.58,4,2,2,有,有,有,58000,380,,0.0,0,,RPQOMLLLPHPFFFA58CC
大安區,建物,臺北市大安區羅斯福路三段151~180號,0.0,其他,,,1090701,土地0建物1車位0,十六層,16,套房(1房1廳1衛),住家用,鋼筋混凝土造,0941102,52.379999999999995,1,1,1,有,有,有,35000,668,,0.0,0,租金含管理費。,RPSOMLLLPHPFFFA78CC
中正區,建物,臺北市中正區和平西路一段1~30號,0.0,商,,,1090714,土地0建物0車位0,十一層,11,套房(1房1廳1衛),商業用,鋼筋混凝土造,,40.67,1,0,1,有,無,有,12800,315,,0.0,0,此為分租套房，房號215，第11層分成22間，一間平均面積為40.67平方公尺,RPVNMLLLPHPFFAA48CC
文山區,建物,臺北市文山區萬隆街52巷1~30號,0.0,住,,,1090701,土地0建物1車位0,五層,6,華廈(10層含以下有電梯),住家用,鋼筋混凝土造,0930827,64.87,2,1,1,有,有,有,17000,262,,0.0,0,,RPPOMLLLPHPFFAA97CC
中正區,建物,臺北市中正區羅斯福路二段8巷1~30號,0.0,商,,,1090706,土地0建物1車位0,二層,9,華廈(10層含以下有電梯),住家用,鋼筋混凝土造,1041014,62.849999999999994,2,1,1,有,無,有,36500,581,,0.0,0,,RPWOMLLLPHPFFAA68CC
中正區,建物,臺北市中正區羅斯福路二段8巷1~30號,0.0,商,,,1090706,土地0建物1車位0,二層,9,華廈(10層含以下有電梯),住家用,鋼筋混凝土造,1041014,62.849999999999994,2,1,1,有,無,有,36500,581,,0.0,0,,RPXOMLLLPHPFFAA78CC
松山區,建物,臺北市松山區南京東路四段181~210號,0.0,商,,,1090713,土地0建物1車位0,十二層,14,住宅大樓(11層含以上有電梯),住家用,鋼筋混凝土造,0730217,86.22,2,1,1,有,無,有,38000,441,,0.0,0,,RPOQMLLLPHPFFDA48DC
文山區,建物,臺北市文山區萬慶街13巷1~30號,0.0,商,,,1090629,土地0建物1車位0,一層,3,店面(店鋪),住家用,加強磚造,0580830,45.05,1,2,1,有,無,有,18000,400,,0.0,0,僅承租一樓,RPUOMLMLPHPFFAA58CC
大安區,建物,臺北市大安區安和路二段1~30號,0.0,住,,,1090713,土地0建物1車位0,四層,12,住宅大樓(11層含以上有電梯),商業用,鋼筋混凝土造,0730508,149.28,3,2,2,有,無,有,52000,348,,0.0,0,,RPTOMLMLPHPFFFA98CC
大安區,建物,臺北市大安區潮州街151~180號,0.0,商,,,1090709,土地0建物1車位0,一層,5,店面(店鋪),商業用,鋼筋混凝土造,0740426,208.87,3,2,2,有,無,無,90000,431,,0.0,0,,RPWOMLMLPHPFFFA66CC
大安區,建物,臺北市大安區新生南路一段103巷1~30號,0.0,住,,,1090612,土地0建物1車位0,四層,7,華廈(10層含以下有電梯),住家用,鋼筋混凝土造,0930211,142.38,3,2,2,有,無,無,53550,376,,0.0,0,,RPXOMLMLPHPFFFA76CC
大安區,建物,臺北市大安區仁愛路四段391~420號,0.0,商,,,1090616,土地0建物1車位0,六層,12,辦公商業大樓,住家用,鋼筋混凝土造,0710227,184.64,3,2,2,有,有,無,66000,357,,0.0,0,,RPOPMLMLPHPFFFA58CC
大安區,建物,臺北市大安區敦化南路一段301~330號,0.0,商,,,1090608,土地0建物1車位0,一層,14,辦公商業大樓,,鋼筋混凝土造,,74.02,0,0,0,無,無,無,65000,878,,0.0,0,,RPPPMLMLPHPFFFA68CC
大安區,建物,臺北市大安區和平東路二段18巷1~30號,0.0,住,,,1090716,土地0建物1車位0,一層,7,華廈(10層含以下有電梯),,鋼筋混凝土造,,124.29,0,0,0,無,無,有,63000,507,,0.0,0,,RPRPMLMLPHPFFFA88CC
大安區,建物,臺北市大安區瑞安街208巷31~60號,0.0,住,,,1090716,土地0建物1車位0,五層,7,華廈(10層含以下有電梯),住家用,鋼筋混凝土造,1040511,43.480000000000004,2,1,1,有,無,有,29000,667,,0.0,0,,RPTPMLMLPHPFFFA09CC
大安區,建物,臺北市大安區仁愛路四段345巷2弄1~30號,0.0,住,,,1090717,土地0建物1車位0,二層,7,辦公商業大樓,住家用,鋼筋混凝土造,,141.87,0,0,0,無,無,有,59000,416,,0.0,0,,RPVPMLMLPHPFFFA66CC
大安區,建物,臺北市大安區建國南路二段1~30號,0.0,商,,,1090717,土地0建物1車位0,十二層,12,住宅大樓(11層含以上有電梯),住家用,鋼筋混凝土造,0780511,143.39000000000001,4,2,2,有,無,有,70000,488,,0.0,0,,RPWPMLMLPHPFFFA76CC
大安區,建物,臺北市大安區忠孝東路四段216巷19弄1~30號,0.0,住,,,1090710,土地0建物1車位0,一層,7,店面(店鋪),住家用,鋼筋混凝土造,,166.67,0,0,0,無,無,無,130000,780,,0.0,0,,RPOQMLMLPHPFFFA68CC
大安區,建物,臺北市大安區忠孝東路四段216巷27弄1~30號,0.0,住,,,1090709,土地0建物1車位0,一層,7,店面(店鋪),住家用,鋼筋混凝土造,,117.2,0,0,0,無,無,無,130000,1109,,0.0,0,,RPQQMLMLPHPFFFA88CC
士林區,建物,臺北市士林區忠誠路一段171巷12弄1~30號,0.0,住,,,1090605,土地0建物1車位0,三層,12,住宅大樓(11層含以上有電梯),住家用,鋼筋混凝土造,0981231,206.37,4,2,2,有,無,有,75000,363,,0.0,0,,RPTNMLMLPHPFFEA78CC
士林區,建物,臺北市士林區天母東路31~60號,0.0,商,,,1090613,土地0建物1車位0,一層,7,華廈(10層含以下有電梯),住家用,鋼筋混凝土造,0740507,192.28,0,0,1,有,無,無,141900,738,,0.0,0,,RPVNMLMLPHPFFEA98CC
士林區,建物,臺北市士林區莊頂路181~210號,0.0,其他,,,1090706,土地0建物1車位0,全,2,透天厝,住家用,加強磚造,0660205,490.02,6,2,3,有,無,無,150000,306,,0.0,0,,RPROMLMLPHPFFEA68CC
士林區,建物,臺北市士林區雨農路32巷12弄1~30號,0.0,住,,,1090716,土地0建物1車位0,一層,4,公寓(5樓含以下無電梯),見使用執照,鋼筋混凝土造,0690227,102.96,2,1,1,有,無,有,20000,194,,0.0,0,台北市都發局社會住宅包租代管第2期計畫,RPTQMLMLPHPFFEA09CC
信義區,建物,臺北市信義區忠孝東路五段790巷59弄1~30號,0.0,住,,,1090716,土地0建物0車位0,四層,4,套房(1房1廳1衛),住家用,加強磚造,0591215,23.81,1,0,1,有,無,有,6000,252,,0.0,0,此為分租套房，第4層共分成4間，一間平均面積約為23.81平方公尺,RPXOMLMLPHPFFDA56CC
信義區,建物,臺北市信義區忠孝東路四段553巷16弄1~30號,0.0,住,,,1090716,土地0建物0車位0,四層,7,套房(1房1廳1衛),住家用,鋼筋混凝土造,0650504,29.62,1,0,1,有,無,有,16500,557,,0.0,0,此為分租套房，第四層共分成3間，一間平均面積約為29.62平方公尺,RPRPMLMLPHPFFDA68CC
信義區,建物,臺北市信義區忠孝東路五段743巷21弄1~30號,0.0,住,,,1090707,土地0建物1車位0,二層,11,住宅大樓(11層含以上有電梯),見其他登記事項,鋼筋混凝土造,1040821,85.58,2,1,1,有,有,有,37000,432,,0.0,0,含管理費,RPTPMLMLPHPFFDA88CC
信義區,建物,臺北市信義區基隆路一段101巷1~30號,0.0,住,,,1090714,土地0建物1車位0,十四層,14,住宅大樓(11層含以上有電梯),見其他登記事項,鋼筋混凝土造,1041118,109.33000000000001,2,1,2,有,無,有,44000,402,,0.0,0,,RPXPMLMLPHPFFDA66CC
信義區,房地(土地+建物),臺北市信義區嘉興街211~240號,23.82,住,,,1090707,土地1建物1車位0,一層,7,店面(店鋪),商業用,鋼筋混凝土造,0701120,120.53999999999999,0,0,0,無,無,無,56000,465,,0.0,0,,RPQQMLMLPHPFFDA68CC
松山區,建物,臺北市松山區市民大道四段211~240號,0.0,住,,,1090714,土地0建物0車位0,五層,5,套房(1房1廳1衛),見使用執照,鋼筋混凝土造,0681015,17.75,1,0,1,有,無,有,9800,552,,0.0,0,此為分租套房，第五層共分成9間，一間平均面積約為17.75平方公尺,RPTQMLMLPHPFFDA98CC
南港區,建物,臺北市南港區忠孝東路六段481~510號,0.0,住,,,1090718,土地0建物0車位0,五層,5,套房(1房1廳1衛),住家用,鋼筋混凝土造,,17.01,1,0,1,有,無,有,10000,588,,0.0,0,此為分租套房，第5層共分成6間，一間平均面積約為17.01平方公尺,RPORMLMLPHPFFDA58CC
萬華區,建物,臺北市萬華區峨眉街121~150號,0.0,商,,,1090716,土地0建物0車位0,二層,5,套房(1房1廳1衛),,鋼筋混凝土造,,35.07,1,0,1,有,無,有,14800,422,,0.0,0,此為分租套房，第二層共分成5間，一間平均面積約為35.07平方公尺。,RPXPMLMLPHPFFBA09CC
大同區,建物,臺北市大同區南京西路331~360號,0.0,其他,,,1090722,土地0建物1車位0,五層,9,華廈(10層含以下有電梯),商業用,鋼筋混凝土造,0790705,201.11,0,0,0,無,無,無,48000,239,,0.0,0,,RPTQMLMLPHPFFBA78CC
中正區,建物,臺北市中正區中華路一段91~120號,0.0,商,,,1090722,土地0建物1車位2,十二層,14,住宅大樓(11層含以上有電梯),見其他登記事項,鋼骨鋼筋混凝土造,1010709,272.8,3,2,3,有,有,有,110000,403,坡道平面,0.0,0,續租。;,RPWQMLMLPHPFFBA09CC
中正區,建物,臺北市中正區八德路一段82巷1~30號,0.0,其他,,,1090719,土地0建物0車位0,三層,3,套房(1房1廳1衛),,加強磚造,,24.4,1,0,1,有,無,有,14500,594,,0.0,0,此為分租套房，第3層共分成3間，一間平均面積約為24.4平方公尺,RPPRMLMLPHPFFBA48CC
中山區,建物,臺北市中山區林森北路391~420號,0.0,商,,,1090702,土地0建物1車位0,九層,12,套房(1房1廳1衛),住家用,鋼筋混凝土造,0710531,34.81,1,1,1,有,有,有,15000,431,,0.0,0,,RPVNMLMLPHPFFCA78CC
中山區,建物,臺北市中山區樂群二路181~210號,0.0,其他,,,1090527,土地0建物1車位3,六層,11,辦公商業大樓,見其他登記事項,見其他登記事項,1040310,514.34,0,0,0,無,有,無,210000,408,坡道平面,122.49,0,,RPQQMLMLPHPFFCA58CC
中山區,建物,臺北市中山區錦西街1~30號,0.0,住,,,1090713,土地0建物0車位0,五層,7,套房(1房1廳1衛),住家用,鋼筋混凝土造,0670502,36.98,1,0,1,有,無,有,14300,387,,0.0,0,此為分租套房，第五層共分成10間，一間平均面積約為36.98平方公尺。,RPSQMLMLPHPFFCA78CC
中山區,建物,臺北市中山區農安街1~30號,0.0,商,,,1090714,土地0建物0車位0,二層,4,套房(1房1廳1衛),住家用,鋼筋混凝土造,0621012,23.33,1,0,1,有,無,有,12500,536,,0.0,0,此為分租套房，第二層共分成4間，一間平均面積約為23.33平方公尺。,RPUQMLMLPHPFFCA98CC
中山區,建物,臺北市中山區北安路458巷47弄1~30號,0.0,住,,,1090718,土地0建物1車位0,二層,14,住宅大樓(11層含以上有電梯),住家用,鋼筋混凝土造,0921209,147.17000000000002,3,2,2,有,有,有,50000,340,,0.0,0,續租。;含管理費,RPVQMLMLPHPFFCA09CC
中山區,建物,臺北市中山區新生北路二段61~90號,0.0,商,,,1090627,土地0建物1車位0,七層,12,套房(1房1廳1衛),商業用,鋼筋混凝土造,0861115,44.94,1,1,1,有,有,有,19500,434,,0.0,0,,RPWQMLMLPHPFFCA56CC
中山區,建物,臺北市中山區林森北路119巷61~90號,0.0,商,,,1090701,土地0建物1車位0,地下一層,7,店面(店鋪),見其他登記事項,鋼筋混凝土造,1050623,110.67,0,0,0,無,有,無,33500,303,,0.0,0,租賃範圍不含車位，且無法區分車位面積。;,RPRRMLMLPHPFFCA78CC
內湖區,建物,臺北市內湖區內湖路二段103巷91~120號,0.0,住,,,1090715,土地0建物1車位0,八層,14,住宅大樓(11層含以上有電梯),住家用,鋼筋混凝土造,0720331,155.21,4,2,2,有,無,有,52000,335,,0.0,0,,RPSSMLMLPHPFFCA98CC
中山區,建物,臺北市中山區樂群二路91~120號,0.0,商,,,1090716,土地0建物1車位3,七層,11,其他,商業用,鋼筋混凝土造,0971121,400.40999999999997,2,2,2,有,無,有,145000,362,坡道平面,92.46,0,,RPUSMLMLPHPFFCA56CC
中山區,建物,臺北市中山區南京東路二段91~120號,0.0,其他,,,1090721,土地0建物1車位0,一層,18,店面(店鋪),見其他登記事項,見其他登記事項,0990917,94.06,0,0,0,無,有,無,175000,1861,,0.0,0,,RPSTMLMLPHPFFCA09CC
內湖區,建物,臺北市內湖區堤頂大道一段331~360號,0.0,其他,,,1090716,土地0建物1車位2,三層,7,辦公商業大樓,見其他登記事項,鋼筋混凝土造,1040203,508.11,0,0,0,無,有,無,158950,313,坡道平面,0.0,5250,,RPUNMLNLPHPFFCA78CC
中山區,建物,臺北市中山區八德路二段211~240號,0.0,商,,,1090715,土地0建物0車位0,三層,5,套房(1房1廳1衛),住家用,鋼筋混凝土造,0610720,26.17,1,0,1,有,無,有,8300,317,,0.0,0,此為分租套房，第三層共分成4間，一間平均面積約為26.17平方公尺。,RPPPMLNLPHPFFCA48CC
中山區,建物,臺北市中山區龍江路211~240號,0.0,商,,,1090722,土地0建物1車位0,八層,14,住宅大樓(11層含以上有電梯),住家用,鋼筋混凝土造,0730803,127.64999999999999,3,2,1,有,有,有,41800,327,,0.0,0,含管理費,RPQPMLNLPHPFFCA58CC
中山區,建物,臺北市中山區南京東路一段132巷1~30號,0.0,商,,,1090715,土地0建物0車位0,七層,7,套房(1房1廳1衛),商業用,鋼筋混凝土造,0681226,21.89,1,0,1,有,無,有,13000,594,,0.0,0,此為分租套房，第七層共分成8間，一間平均面積約為21.89平方公尺。,RPRPMLNLPHPFFCA68CC
內湖區,建物,臺北市內湖區星雲街210巷31~60號,0.0,住,,,1090705,土地0建物1車位0,九層,14,住宅大樓(11層含以上有電梯),住家用,鋼筋混凝土造,0891101,87.99000000000001,3,2,2,有,有,有,29000,330,,0.0,0,,RPXQMLNLPHPFFCA76CC
內湖區,建物,臺北市內湖區民權東路六段121~150號,0.0,商,,,1090704,土地0建物1車位0,十二層,14,套房(1房1廳1衛),住家用,鋼筋混凝土造,0980106,42.1,1,1,1,有,有,有,18000,428,,0.0,0,租賃範圍不含車位，且無法區分車位面積。;,RPORMLNLPHPFFCA58CC
內湖區,建物,臺北市內湖區成功路四段324巷1弄1~30號,0.0,住,,,1090704,土地0建物1車位0,三層,5,公寓(5樓含以下無電梯),住家用,鋼筋混凝土造,0730113,103.07,3,2,2,有,無,有,28400,276,,0.0,0,,RPPRMLNLPHPFFCA68CC
大同區,建物,臺北市大同區民權西路91~120號,0.0,商,,,1090713,土地0建物1車位0,十三層,14,辦公商業大樓,住家用,鋼筋混凝土造,1000330,202.48,3,2,2,有,有,無,85000,420,,0.0,0,,RPSNMLNLPHPFFBA48CC
中正區,建物,臺北市中正區重慶南路一段1~30號,0.0,商,,,1090723,土地0建物1車位0,一層,12,店面(店鋪),商業用,鋼筋混凝土造,0661201,119.03,0,0,0,無,有,無,130000,1092,,0.0,0,,RPXNMLNLPHPFFBA98CC
大同區,建物,臺北市大同區迪化街二段331~360號,0.0,住,,,1090703,土地0建物1車位0,一層,5,套房(1房1廳1衛),商業用,鋼筋混凝土造,0740423,60.56,1,1,1,有,無,無,25000,413,,0.0,0,含增建或未登記建物。;,RPWOMLNLPHPFFBA98CC
松山區,建物,臺北市松山區光復北路11巷31~60號,0.0,住,,,1090701,土地0建物1車位0,七層,14,辦公商業大樓,商業用,鋼骨混凝土造,0820202,1232.85,0,0,0,無,有,無,626539,508,,0.0,0,租金含稅。,RPTOMLNLPHPFFDA88CC
松山區,建物,臺北市松山區南京東路五段211~240號,0.0,其他,,,1090715,土地0建物1車位0,十三層,18,住宅大樓(11層含以上有電梯),住家用,鋼筋混凝土造,0980331,55.68000000000001,1,1,1,有,有,無,28000,503,,0.0,0,,RPOPMLNLPHPFFDA48CC
松山區,建物,臺北市松山區八德路二段346巷3弄1~30號,0.0,商,,,1090714,土地0建物1車位0,見其他登記事項,5,公寓(5樓含以下無電梯),見使用執照,鋼筋混凝土造,0750729,194.29,3,3,3,有,無,無,68112,351,,0.0,0,,RPSPMLNLPHPFFDA88CC
北投區,建物,臺北市北投區中和街507巷1~30號,0.0,住,,,1090704,土地0建物1車位1,見其他登記事項,6,華廈(10層含以下有電梯),商業用,鋼筋混凝土造,0841013,162.15,3,2,2,有,有,有,29000,179,,0.0,0,含增建或未登記建物。;租金含管理費。車位面積無法分算。,RPTNMLNLPHPFFEA88CC
北投區,建物,臺北市北投區中和街493巷1弄1~30號,0.0,住,,,1090715,土地0建物0車位0,四層,5,套房(1房1廳1衛),住家用,鋼筋混凝土造,0711227,25.27,1,0,1,有,無,有,7000,277,,0.0,0,此為分租套房，第四層共分成4間，一間平均面積約為25.27平方公尺。,RPUOMLNLPHPFFEA09CC
北投區,建物,臺北市北投區新民路31~60號,0.0,住,,,1090705,土地0建物1車位0,七層,10,套房(1房1廳1衛),住家用,鋼筋混凝土造,0970221,27.509999999999998,1,1,1,有,有,有,13000,473,,0.0,0,租金含管理費。,RPUPMLNLPHPFFEA56CC
大安區,建物,臺北市大安區敦化南路一段181~210號,0.0,商,,,1090610,土地0建物1車位0,十二層,14,住宅大樓(11層含以上有電梯),住家用,鋼筋混凝土造,,199.29,4,2,2,有,有,無,84000,421,,0.0,0,,RPQNMLNLPHPFFFA68CC
大安區,建物,臺北市大安區泰順街60巷1~30號,0.0,住,,,1090704,土地0建物1車位0,七層,7,華廈(10層含以下有電梯),住家用,鋼筋混凝土造,,146.09,3,2,2,有,無,有,40000,274,,0.0,0,租金含管理費。,RPUOMLNLPHPFFFA56CC
大安區,建物,臺北市大安區忠孝東路四段216巷27弄1~30號,0.0,住,,,1090721,土地0建物1車位0,一層,7,店面(店鋪),住家用,鋼筋混凝土造,,117.2,0,1,1,有,有,無,107844,920,,0.0,0,,RPUNMLOLPHPFFFA56CC
大安區,建物,臺北市大安區復興南路二段31~60號,0.0,商,,,1090625,土地0建物1車位0,十層,12,住宅大樓(11層含以上有電梯),住家用,鋼筋混凝土造,0691024,136.76,3,1,2,有,有,無,50000,366,,0.0,0,,RPXNMLOLPHPFFFA86CC
大安區,建物,臺北市大安區復興南路二段78巷1~30號,2.89,住,,,1090703,土地0建物1車位0,三層,7,華廈(10層含以下有電梯),住家用,鋼筋混凝土造,0730611,162.88,4,2,2,有,無,有,48000,295,,0.0,0,,RPRPMLOLPHPFFFA09CC
大安區,建物,臺北市大安區延吉街61~90號,0.0,住,,,1090630,土地0建物1車位0,一層,4,店面(店鋪),住家用,鋼筋混凝土造,0601208,73.34,0,0,0,無,無,無,75000,1023,,0.0,0,,RPSPMLOLPHPFFFA56CC
大安區,建物,臺北市大安區新生南路一段161巷1~30號,0.0,住,,,1090715,土地0建物1車位0,一層,5,公寓(5樓含以下無電梯),住家用,鋼筋混凝土造,0690401,209.66,0,0,0,無,無,無,105000,501,,0.0,0,,RPTPMLOLPHPFFFA66CC
大安區,建物,臺北市大安區溫州街1~30號,0.0,住,,,1090716,土地0建物1車位0,一層,7,店面(店鋪),商業用,鋼筋混凝土造,0750905,235.17000000000002,2,1,1,有,有,無,96492,410,,0.0,0,,RPXPMLOLPHPFFFA07CC
大安區,建物,臺北市大安區延吉街241~270號,0.0,住,,,1090723,土地0建物1車位0,一層,4,店面(店鋪),住家用,鋼筋混凝土造,,104.39,0,0,0,無,無,無,82870,794,,0.0,0,,RPQQMLOLPHPFFFA09CC
大安區,建物,臺北市大安區辛亥路一段91~120號,0.0,其他,,,1090706,土地0建物1車位0,二十一層,27,住宅大樓(11層含以上有電梯),住家用,鋼筋混凝土造,0791219,176.39,3,2,2,有,有,有,50000,283,,0.0,0,,RPSQMLOLPHPFFFA66CC
